{
  "schema_version": "1.0",
  "proposal_id": "d4e5f6a7-b8c9-4d0e-9f1a-3b4c5d6e7f8a",
  "strategy_id": "b2c3d4e5-f6a7-4b8c-9d0e-1f2a3b4c5d6e",
  "agent_trace_id": "e5f6a7b8-c9d0-4e1f-8a2b-4c5d6e7f8a9b",
  "created_at": "2026-07-04T16:00:00Z",
  "symbol": "BTC/USDT",
  "action": "hold",
  "size_quote": "0",
  "entry": {
    "type": "market"
  },
  "time_in_force": "gtc",
  "confidence": 0.24,
  "reasoning": "Analyst signals are mixed and low-conviction; debate produced no clear edge. Confidence below the 0.3 action threshold, therefore hold.",
  "analyst_summaries": {
    "market": {
      "signal": "neutral",
      "confidence": 0.4,
      "summary": "Price inside multi-day range; no actionable setup."
    },
    "news": {
      "signal": "bearish",
      "confidence": 0.35,
      "summary": "Mildly negative headlines, low volume of coverage."
    },
    "fundamental": {
      "signal": "neutral",
      "confidence": 0.5,
      "summary": "No material changes since previous run."
    }
  },
  "debate_summary": "Neither side established an edge; judge recommends waiting for range resolution.",
  "model_costs": []
}
